{
  "schema_version": 2,
  "purpose": "Full evidence ledger for GauntletAI ShipShape reviewer claims. Categories 1-8 are represented with source requirements, measurements, derived metrics, bounded claims, evidence pointers, caveats, and acceptance tests. The dashboard is generated from this file; do not make reviewer claims outside this ledger.",
  "status_values": [
    "proven",
    "partial",
    "open",
    "needs_fill_in",
    "not_measured"
  ],
  "evidence_types": [
    "source_doc",
    "methodology",
    "command",
    "artifact",
    "screenshot",
    "test_run",
    "manual_observation"
  ],
  "measurement_origins": [
    "manual_entry",
    "report_extracted",
    "artifact_parsed",
    "computed"
  ],
  "confidence_values": [
    "artifact_backed",
    "report_backed",
    "manual",
    "inferred"
  ],
  "categories": [
    {
      "id": "cat-1-type-safety",
      "number": 1,
      "title": "Type Safety",
      "status": "proven",
      "source_requirement": {
        "statement": "Eliminate 25% of type safety violations. Every fix must preserve existing functionality; all tests still pass. Superficial fixes do not count. Replacing any with unknown without proper type narrowing is not an improvement; fixes must include correct, meaningful types that reflect the actual data.",
        "source": "my-docs/project-weeks-sot/week-4/GFA-Week-4-ShipShape.txt"
      },
      "audit_deliverable": {
        "source": "my-docs/project-weeks-sot/week-4/AUDIT_REPORT.md",
        "fields": {
          "total_any_types": 278,
          "total_type_assertions": 713,
          "total_non_null_assertions": 348,
          "total_ts_ignore_or_ts_expect_error": 1,
          "strict_mode_enabled": true,
          "strict_mode_error_count_if_disabled": null,
          "strict_mode_error_count_note": "N/A because strict mode is enabled."
        },
        "top_violation_dense_files": [
          {
            "rank": 1,
            "path": "api/src/routes/weeks.ts",
            "count": 85,
            "why_problematic": "High-risk route boundary code mixed request input, JSONB document properties, database rows, and API responses, so unsafe casts or non-null assertions could become runtime contract bugs."
          },
          {
            "rank": 2,
            "path": "api/src/routes/projects.ts",
            "count": 51,
            "why_problematic": "Project route code shaped document-backed project responses from loosely typed PostgreSQL rows and properties, making route/API drift hard for TypeScript to catch."
          },
          {
            "rank": 3,
            "path": "api/src/routes/issues.ts",
            "count": 49,
            "why_problematic": "Issue routes sit on the core issue/document boundary and previously relied on casts around request bodies, associations, properties, and list/detail response shaping."
          },
          {
            "rank": 4,
            "path": "web/src/pages/UnifiedDocumentPage.tsx",
            "count": 37,
            "why_problematic": "The unified document page bridges routed document types, editor state, and API responses; loose typing here can misroute editor views or hide document-shape mismatches."
          },
          {
            "rank": 5,
            "path": "api/src/db/seed.ts",
            "count": 35,
            "why_problematic": "Seed data drives local audit/test scenarios; dense non-null assertions can mask invalid fixture assumptions and make evidence setup brittle."
          }
        ],
        "notes": [
          "The audit deliverable asks for total counts; production counts are included in measurements because they are useful for judging source-risk reduction.",
          "Strict mode is a configuration finding, not a syntax-count measurement."
        ]
      },
      "rubric_items": [
        {
          "id": "cat1-audit-total-any-types",
          "phase": "audit",
          "required": true,
          "status": "present",
          "location": "measurements[cat1-baseline-ast-counts].values.any_total"
        },
        {
          "id": "cat1-audit-total-type-assertions",
          "phase": "audit",
          "required": true,
          "status": "present",
          "location": "measurements[cat1-baseline-ast-counts].values.type_assertions_total"
        },
        {
          "id": "cat1-audit-total-non-null-assertions",
          "phase": "audit",
          "required": true,
          "status": "present",
          "location": "measurements[cat1-baseline-ast-counts].values.non_null_assertions_total"
        },
        {
          "id": "cat1-audit-total-ts-suppressions",
          "phase": "audit",
          "required": true,
          "status": "present",
          "location": "measurements[cat1-baseline-ast-counts].values.ts_suppressions_total"
        },
        {
          "id": "cat1-audit-strict-mode-enabled",
          "phase": "audit",
          "required": true,
          "status": "present",
          "location": "audit_deliverable.fields.strict_mode_enabled"
        },
        {
          "id": "cat1-audit-strict-mode-error-count-if-disabled",
          "phase": "audit",
          "required": true,
          "status": "not_applicable",
          "location": "audit_deliverable.fields.strict_mode_error_count_if_disabled",
          "reason": "Strict mode is enabled."
        },
        {
          "id": "cat1-audit-top-5-dense-files",
          "phase": "audit",
          "required": true,
          "status": "present",
          "location": "audit_deliverable.top_violation_dense_files"
        },
        {
          "id": "cat1-improvement-25-percent-reduction",
          "phase": "improvement",
          "required": true,
          "status": "present",
          "location": "claims[cat1-clears-total-25-percent-counted-syntax-reduction]"
        },
        {
          "id": "cat1-improvement-tests-still-pass",
          "phase": "improvement",
          "required": true,
          "status": "present",
          "location": "evidence[cat1-api-tests], evidence[cat1-web-tests]"
        },
        {
          "id": "cat1-improvement-meaningful-types",
          "phase": "improvement",
          "required": true,
          "status": "present",
          "location": "evidence[cat1-meaningful-boundary-narrowing]"
        }
      ],
      "measurements": [
        {
          "id": "cat1-baseline-ast-counts",
          "kind": "typescript_ast_syntax_counts",
          "label": "Baseline AST counts",
          "recorded_at": "2026-05-19",
          "scope": {
            "roots": ["api/src", "web/src", "shared/src", "e2e"],
            "production_excludes_tests": true
          },
          "values": {
            "any_total": 278,
            "any_production": 94,
            "type_assertions_total": 713,
            "type_assertions_production": 504,
            "non_null_assertions_total": 348,
            "non_null_assertions_production": 325,
            "ts_suppressions_total": 1,
            "ts_suppressions_production": 0
          },
          "package_breakdown": {
            "api/src": {
              "any": 238,
              "type_assertions": 317,
              "non_null_assertions": 296,
              "ts_suppressions": 0,
              "counted_total": 851
            },
            "web/src": {
              "any": 33,
              "type_assertions": 372,
              "non_null_assertions": 33,
              "ts_suppressions": 1,
              "counted_total": 439
            },
            "shared/src": {
              "any": 0,
              "type_assertions": 2,
              "non_null_assertions": 0,
              "ts_suppressions": 0,
              "counted_total": 2
            },
            "e2e": {
              "any": 7,
              "type_assertions": 22,
              "non_null_assertions": 19,
              "ts_suppressions": 0,
              "counted_total": 48
            }
          },
          "production_package_breakdown": {
            "api/src": {
              "any": 65,
              "type_assertions": 146,
              "non_null_assertions": 292,
              "ts_suppressions": 0,
              "counted_total": 503
            },
            "web/src": {
              "any": 29,
              "type_assertions": 356,
              "non_null_assertions": 33,
              "ts_suppressions": 0,
              "counted_total": 418
            },
            "shared/src": {
              "any": 0,
              "type_assertions": 2,
              "non_null_assertions": 0,
              "ts_suppressions": 0,
              "counted_total": 2
            }
          },
          "origin": "report_extracted",
          "confidence": "artifact_backed",
          "source": "my-docs/project-weeks-sot/week-4/AUDIT_REPORT.md",
          "artifact": "my-docs/evidence/cat1-baseline-ast-counts-5731a92.json"
        },
        {
          "id": "cat1-latest-ast-counts",
          "kind": "typescript_ast_syntax_counts",
          "label": "Latest AST counts",
          "recorded_at": "2026-05-22",
          "scope": {
            "roots": ["api/src", "web/src", "shared/src", "e2e"],
            "production_excludes_tests": true
          },
          "values": {
            "any_total": 76,
            "any_production": 1,
            "type_assertions_total": 479,
            "type_assertions_production": 372,
            "non_null_assertions_total": 69,
            "non_null_assertions_production": 36,
            "ts_suppressions_total": 1,
            "ts_suppressions_production": 0
          },
          "package_breakdown": {
            "api/src": {
              "any": 68,
              "type_assertions": 185,
              "non_null_assertions": 47,
              "ts_suppressions": 0,
              "counted_total": 300
            },
            "web/src": {
              "any": 4,
              "type_assertions": 243,
              "non_null_assertions": 4,